Image Name,Ingredient List
IMG01,"eggs, carrots, tomato, dressing, lettuce, bread, cucmber, banana, grapes, garlic, capsicum, peppers, milk, meat, mushroom"
IMG02,"nuts, seeds, dates, pear, apple, cheese, mayonise, dressing, banana, tomato, orange, lime, lemon, capsicum, peppers, carrot, purple cabbage, milk, meat "
IMG03,"green apple, beans, honey, tomato, eggs, grapes, capsicum, peppers, lemon, cucumber, carrot, cilantro, watermelon"
IMG04,"Eggs, milk, grapes, black berry, blur berry, mango, meat"
IMG05,"avacado, tomato, nuts, fig, starwberry, brocoli, apple, yam, kale, banana, lemon, radish, orange, peppers, capsicum, pumpkin"